<?xml version="1.0" encoding="UTF-8"?>
<!DOCTYPE InventoryTree SYSTEM "inventoryTree.dtd">

<InventoryTree>
   <Name>WTTH</Name>
   <Solution>
      <Name>WTTH</Name>
      <Label>
         <Value bold="false" italic="false">HPESA</Value>
      </Label>
   </Solution>
   <Description>Arbol Tablas General</Description>
   <OperationTypeName>
      <Name>Create</Name>
   </OperationTypeName>
   <OperationTypeName>
      <Name>View</Name>
   </OperationTypeName>
   <OperationTypeName>
      <Name>Edit</Name>
   </OperationTypeName>
   <OperationTypeName>
      <Name>Delete</Name>
   </OperationTypeName>
   <BranchTypeName>
      <Name>General</Name>
   </BranchTypeName>
   <Branch>
      <Name>WTTH</Name>
      <DefName>WTTH</DefName>
      <Image>customer.gif</Image>
      <Label>
         <Value bold="false" italic="false">WTTH</Value>
      </Label>
      <Children>
         <Child>Customer</Child>
         <Child>Services</Child>
         <Child>Service_Params</Child>
         <Child>Service_Mapping</Child>
         <Child>Action_Templates</Child>
         <Child>Network_Element</Child>
         <Child>Error_Handling</Child>
         <Child>Configuration_Params</Child>
         <Child>lrt_ims_to_mov</Child>
         <Child>lrt_mov_to_ims</Child>
      </Children>
   </Branch>
   <Branch>
      <Name>Customer</Name>
      <DefName>Customer</DefName>
      <BranchType>General</BranchType>
      <Type>General</Type>
      <Image>customer.gif</Image>
      <Label>
         <Value bold="false" italic="false">constant:Customer</Value>
      </Label>
      <Children>
         <Child>GENSERV_CUSTOMER</Child>
      </Children>
      <Operation>
         <Name>Create Customer</Name>
         <Image>customer.gif</Image>
         <OperationType>Create</OperationType>
         <Action>
            <Page>CreationFormCustomerAction.do</Page>
         </Action>
      </Operation>
   </Branch>
   <Branch>
      <Name>GENSERV_CUSTOMER</Name>
      <DefName>GENSERV_CUSTOMER</DefName>
      <Image>software.gif</Image>
      <Class-Name>com.hpe.ov.activator.inventory.Customer</Class-Name>
      <Find-By>
         <Method>findAll</Method>
      </Find-By>
      <Label>
         <Value bold="false" italic="false">$GENSERV_CUSTOMER.CUSTOMER_ID$ - $GENSERV_CUSTOMER.CUSTOMER$</Value>
      </Label>
      <Operation default="true">
         <Name>View</Name>
         <Image>customer.gif</Image>
         <Object>GENSERV_CUSTOMER</Object>
         <OperationType>View</OperationType>
         <Action>
            <Page>ViewFormCustomerAction.do</Page>
            <Param>
               <Name>CUSTOMER</Name>
               <Value>GENSERV_CUSTOMER.CUSTOMER_ID</Value>
            </Param>
         </Action>
      </Operation>
      <Operation>
         <Name>Edit</Name>
         <Image>edit.gif</Image>
         <Object>CUSTOMER</Object>
         <OperationType>Edit</OperationType>
         <Action>
            <Page>UpdateFormCustomerAction.do</Page>
            <Param>
               <Name>CUSTOMER</Name>
               <Value>GENSERV_CUSTOMER.CUSTOMER_ID</Value>
            </Param>
         </Action>
      </Operation>
      <Operation>
         <Name>Delete</Name>
         <Image>delete.gif</Image>
         <Object>CUSTOMER</Object>
         <OperationType>Delete</OperationType>
         <Action>
            <Page>DeleteFormCustomerAction.do</Page>
            <Param>
               <Name>COSTUMER</Name>
               <Value>GENSERV_COSTUMER.COSTUMER_ID</Value>
            </Param>
         </Action>
      </Operation>
      <Operation>
         <Name>Create</Name>
         <Image>services.gif</Image>
         <OperationType>Create</OperationType>
         <Action>
            <Page>CreationFormCustomerAction.do</Page>
         </Action>
      </Operation>
   </Branch>
   <Branch>
      <Name>Services</Name>
      <DefName>Services</DefName>
      <BranchType>General</BranchType>
      <Type>General</Type>
      <Image>services.gif</Image>
      <Label>
         <Value bold="false" italic="false">constant:Services</Value>
      </Label>
      <Children>
         <Child>GENSERV_SERVICES</Child>
      </Children>
      <Operation>
         <Name>Create Services</Name>
         <Image>package.gif</Image>
         <OperationType>Create</OperationType>
         <Action>
            <Page>CreationFormServicesAction.do</Page>
         </Action>
      </Operation>
   </Branch>
   <Branch>
      <Name>GENSERV_SERVICES</Name>
      <DefName>GENSERV_SERVICES</DefName>
      <Image>software.gif</Image>
      <Class-Name>com.hpe.ov.activator.inventory.Services</Class-Name>
      <Find-By>
         <Method>findAll</Method>
      </Find-By>
      <Label>
         <Value bold="false" italic="false">$GENSERV_SERVICES.SERVICE_ID$</Value>
      </Label>
      <Operation default="true">
         <Name>View</Name>
         <Image>services.gif</Image>
         <Object>SERVICES</Object>
         <OperationType>View</OperationType>
         <Action>
            <Page>ViewFormServicesAction.do</Page>
            <Param>
               <Name>SERVICE_ID</Name>
               <Value>GENSERV_SERVICES.SERVICE_ID</Value>
            </Param>
         </Action>
      </Operation>
      <Operation>
         <Name>Edit</Name>
         <Image>edit.gif</Image>
         <Object>SERVICES</Object>
         <OperationType>Edit</OperationType>
         <Action>
            <Page>UpdateFormServicesAction.do</Page>
            <Param>
               <Name>SERVICE_ID</Name>
               <Value>GENSERV_SERVICES.SERVICE_ID</Value>
            </Param>
         </Action>
      </Operation>
      <Operation>
         <Name>Delete</Name>
         <Image>delete.gif</Image>
         <Object>SERVICES</Object>
         <OperationType>Delete</OperationType>
         <Action>
            <Page>DeleteFormServicesAction.do</Page>
            <Param>
               <Name>SERVICE_ID</Name>
               <Value>GENSERV_SERVICES.SERVICE_ID</Value>
            </Param>
         </Action>
      </Operation>
      <Operation>
         <Name>Create Service</Name>
         <Image>services.gif</Image>
         <OperationType>Create</OperationType>
         <Action>
            <Page>CreationFormServicesAction.do</Page>
         </Action>
      </Operation>
   </Branch>
   <Branch>
      <Name>Service_Params</Name>
      <DefName>Service_Params</DefName>
      <BranchType>General</BranchType>
      <Type>General</Type>
      <Image>services.gif</Image>
      <Label>
         <Value bold="false" italic="false">constant:Service_Params</Value>
      </Label>
      <Children>
         <Child>GENSERV_SERVICE_PARAMS</Child>
      </Children>
      <Operation>
         <Name>Create</Name>
         <Image>services.gif</Image>
         <OperationType>Create</OperationType>
         <Action>
            <Page>CreationFormServiceParamsAction.do</Page>
         </Action>
      </Operation>
   </Branch>
   <Branch>
      <Name>GENSERV_SERVICE_PARAMS</Name>
      <DefName>GENSERV_SERVICE_PARAMS</DefName>
      <Image>software.gif</Image>
      <Class-Name>com.hpe.ov.activator.inventory.ServiceParams</Class-Name>
      <Find-By>
         <Method>findAll</Method>
      </Find-By>
      <Label>
         <Value bold="false" italic="false">$GENSERV_SERVICE_PARAMS.PARAM_NAME$</Value>
      </Label>
      <Operation default="true">
         <Name>View</Name>
         <Image>services.gif</Image>
         <Object>GENSERV_SERVICE_PARAMS</Object>
         <OperationType>View</OperationType>
         <Action>
            <Page>ViewFormServiceParamsAction.do</Page>
            <Param>
               <Name>PARAM_NAME</Name>
               <Value>GENSERV_SERVICE_PARAMS.PARAM_NAME</Value>
            </Param>
         </Action>
      </Operation>
      <Operation>
         <Name>Edit</Name>
         <Image>edit.gif</Image>
         <Object>GENSERV_SERVICE_PARAMS</Object>
         <OperationType>Edit</OperationType>
         <Action>
            <Page>UpdateFormServiceParamsAction.do</Page>
            <Param>
               <Name>PARAM_NAME</Name>
               <Value>GENSERV_SERVICE_PARAMS.PARAM_NAME</Value>
            </Param>
         </Action>
      </Operation>
      <Operation>
         <Name>Delete</Name>
         <Image>delete.gif</Image>
         <Object>GENSERV_SERVICE_PARAMS</Object>
         <OperationType>Delete</OperationType>
         <Action>
            <Page>DeleteFormServiceParamsAction.do</Page>
            <Param>
               <Name>PARAM_NAME</Name>
               <Value>GENSERV_SERVICE_PARAMS.PARAM_NAME</Value>
            </Param>
         </Action>
      </Operation>
      <Operation>
         <Name>Create</Name>
         <Image>services.gif</Image>
         <OperationType>Create</OperationType>
         <Action>
            <Page>CreationFormServiceParamsAction.do</Page>
         </Action>
      </Operation>
   </Branch>
   <Branch>
      <Name>Service_Mapping</Name>
      <DefName>Service_Mapping</DefName>
      <BranchType>General</BranchType>
      <Type>General</Type>
      <Image>services.gif</Image>
      <Label>
         <Value bold="false" italic="false">constant:Service_Mapping</Value>
      </Label>
      <Children>
         <Child>GENSERV_SERVICE_MAPPING</Child>
      </Children>
      <Operation>
         <Name>Create</Name>
         <Image>services.gif</Image>
         <OperationType>Create</OperationType>
         <Action>
            <Page>CreationFormServiceMappingAction.do</Page>
         </Action>
      </Operation>
   </Branch>
   <Branch>
      <Name>GENSERV_SERVICE_MAPPING</Name>
      <DefName>GENSERV_SERVICE_MAPPING</DefName>
      <Image>software.gif</Image>